platform,rating,text,date,thumbsUp,reviewer
Just Eat,1,horrendous.. food never delivered even tho the says delivered .. was asked to check my front door for the order when it was never collected from the restaurant 😂😂,2025-05-11 21:35:15,0,Ken O'connor
Just Eat,1,"7/8 times I use the app, I fill out an order and it just doesn't work when I press the order button.",2025-05-07 20:56:28,1,Quinnthropy
Just Eat,3,good app. missed the collection toggle. please move it down and highlight it.,2025-05-03 21:08:03,1,lily murphy
Just Eat,1,This app is the worst app to order food from I ordered food from this app lots of times especially Burger King and there were incidents such as the driver arriving with either half eaten items or items completely missing from our order but today tops it all I told the driver my address and he for some stupid reason delivered my food to the wrong address I called the head office and asked them to send another order around but they said it wasn't possible and could only get a refund AVOID,2025-05-03 16:15:09,2,Elvedin
Just Eat,5,pay your worker better please... they are lovely,2025-05-03 03:25:20,0,Natalia Fernandez
Just Eat,4,Pizza okay. base a little soggy. Very quick delivery.,2025-05-03 00:34:42,0,Moon Shine
Just Eat,2,"service fee €2.99? and then €3.99 for delivery? service fee should be charged to the restaraunts for using the service, and not the users. So 7 euro on top of my 12 euro order? Absolute joke, I won't use that app ever again. Most restaurants have their own apps or orders through website, no ""service fees"", and cheap or free delivery service.",2025-05-03 00:18:57,5,Josip Sruk
Just Eat,1,very bad,2025-05-02 19:18:54,0,Celine Guildea
Just Eat,1,"Orders repeatedly cancelled or not processed without telling me, leaving me to call restaurants an hour later to find out. Horrific customer service, avoid and order direct from restaurants",2025-05-02 01:08:40,0,Ed Platt
Just Eat,1,"Always missing items, no matter from where.",2025-05-01 00:43:17,0,Nicola Molloy
Just Eat,5,Brilliant as always. Thanks again guys 😃,2025-04-30 16:14:00,0,Marie Sheahan
Just Eat,1,"app works but no option to tip riders, food goes missing half the time, stay away from this app",2025-04-27 23:45:53,0,Solti Daniel
Just Eat,1,"Please use any other delivery app - They will take your money, not deliver your food and then tell you there's nothing they can do. Absolute joke, Don't know why they even bother a customer service number.",2025-04-27 00:22:21,0,Eoin McG
Just Eat,2,the app and website doesn't work properly when you get to the checkout and all so will not use my address or eir code so they deliver to the neighbours,2025-04-26 20:51:17,0,NOD King
Just Eat,4,did somebody say just eat,2025-04-25 20:26:05,0,Ry an is cool (Ryan)
Just Eat,1,"I've ordered from this app several times and there's always been something wrong with it being late, cold or just cancelled all together. The options are fairly limited and the app expects you to pay a tip before you have even gotten your food. Just use deliveroo instead.",2025-04-24 22:48:41,2,Conor Twomey
Just Eat,5,Great food and quick service.,2025-04-23 01:20:12,0,Eamonn Moroney
Just Eat,1,"order was never delivered due to driver error and just eat refuses to refund payment. or give any kind of compensation, terrible customer support. this would be a great service if there were more protections for the consumer as it's because of driver error that most problems arise but it's still the consumer that loses in the end. came back to edit this as a similar case just occurred. driver was outside, claimed to not be the driver and right after he left the order was completed. food stolen",2025-04-22 23:50:03,1,Andrew miller
Just Eat,5,Excellent - Very quick & to the point,2025-04-22 21:52:43,1,Mark Carey
Just Eat,1,use to love this app. won't let you pay by card anymore and was waiting on chat for ages for a reply but never got one. serious decline in standards,2025-04-21 22:47:24,0,andrew lynch
Just Eat,1,"recieved easter €5 off voucher when ordering the app wouldn't allow me to click into card security code field to pay, exited app and returned to be told voucher code had 'been used'...... magically no problem paying at full price. Not the first instance of non working scam vouchers, will be deleting app as soon as order is delivered",2025-04-21 22:10:47,2,Ian Coleman
Just Eat,5,very polite,2025-04-21 01:24:56,0,Phyllis Keane
Just Eat,3,First Burger King I ordered from let me go through an entire order for 4 people then when I went to pay said they were not taking orders. That should have been advised before I went through the order 😕,2025-04-20 01:29:53,0,TheNowandThenCompany
Just Eat,5,amazing,2025-04-19 20:59:29,0,Latifah
Just Eat,1,have a 25er gift card that cant be used even though it hasnt expired,2025-04-18 23:49:40,0,M b
Just Eat,1,always something missing from the order and I know it isn't the restaurants fault. as they never make a mistake when I order from them. Save your money and drive to the restaurant it saves you a lot of grief.,2025-04-18 23:45:29,1,Anita Healy
Just Eat,2,cold chips..pizza too cheesy & flavourless,2025-04-18 02:04:42,0,Helen English
Just Eat,1,Unbelievable,2025-04-16 21:13:11,0,ursula tansey
Just Eat,1,won't let me use voucher code on restaurant,2025-04-14 00:07:24,0,Rdwn Morroco
Just Eat,4,"great app for ordering , easy payment and quick delivery 👌",2025-04-13 23:49:47,0,Natan Sprinceana
Just Eat,2,the just eat app is good but it said I'd get 90 euros of eat fresh credit if I joined today which I did but the credit was not applied,2025-04-13 17:12:57,0,Meg McCarthy
Just Eat,2,"joke of an app, huge service charges and makes prices of items higher than on the actual resturaunts prices. Scam app.",2025-04-12 01:38:07,0,Cillian Doyle
Just Eat,5,love the food,2025-04-11 19:17:57,0,Stacey Lorrell
Just Eat,2,Don't trust the halal filter. Contact the restaurant to confirm if its 100% halal. some restaurants have a combination of halal and non halal items.,2025-04-10 14:57:28,0,LM LH
Just Eat,4,very good service,2025-04-10 00:40:34,0,Danielle O mahony
Just Eat,2,"App keeps changing the delivery address from the one in my address book to my neighbours house, even after we deleted all addresses in the book.",2025-04-08 23:49:23,0,CC
Just Eat,5,fast as lightning ⚡,2025-04-06 23:27:37,0,John Harrington
Just Eat,1,very unsatisfactory customer service.,2025-04-06 02:06:18,0,Edwina Roycroft
Just Eat,5,excellent,2025-04-06 00:07:38,0,Ashraful Islam
Just Eat,1,do not order from this I have had numerous restaurants and takeaways not deliver plus no refund,2025-03-31 01:54:23,0,Tommy Teehan
Just Eat,3,"Yeah, you can order food on it",2025-03-31 00:28:16,0,Samuel McKeon
Just Eat,2,forgot curry sauce with the order,2025-03-30 04:49:25,0,david cunningham
Just Eat,5,is food for when you are to lazy to go out or cook,2025-03-30 03:34:35,0,alex playz
Just Eat,1,"At the last minute, my order was cancelled at McDonald's... when I was in a hurry and didn't have much time, I used this service. At the last damn minute, they cancelled my order because they didn't have a delivery person... I live 5 minutes away, so I decided to arrive late and order at the last minute so they could cancel it. horrible experience",2025-03-28 02:49:27,1,Elena Otilia Maria Manciu
Just Eat,1,"This sleazy app sends advertisements as notifications, including sound, distracting me with offers during the day. The notification categories do not clearly label which one is for advertising. All toggle switches related to advertising in the app settings are disabled, yet the notifications keep coming. Truly despicable. Uninstalling immediately.",2025-03-25 18:54:27,4,JP Rupp
Just Eat,1,"The built-in Map is buggy and slow. Built-in customer service is extremely slow and inefficient (It goes through email instead of a phone number or live chat), there was one option to do a livechat but I had to find it. There was no clearly stated customer service number either, so I had to find it through Google instead. Sometimes in-app calls do not even show up on your side. Experienced a courier lying about delivering my order in a 'safe place'. I did not receive my order.",2025-03-23 23:00:28,5,Ryan Tan
Just Eat,3,food was good but gave me wedges instead of wings,2025-03-23 07:16:07,0,jason mc feely
Just Eat,5,"Fantastic quality authentic & generous portions, using great ingredients. I love this place.",2025-03-22 21:43:28,8,Dara O Reilly
Just Eat,5,"Love it, too easy to waste money",2025-03-20 04:29:39,0,oOjenahsOo
Just Eat,2,Quite annoying that just eat does not save old orders if the menu is updated. I ordered from McDonald's but when I clicked order again only a select number of items came up. I didn't notice until later and had to order again by manually going through McDonald's menu again.,2025-03-19 03:42:40,1,Thomas Flanagan
Just Eat,1,"Useless if, like me, you live in the back end of nowhere. I cannot comment on how useful it might be if you live in D4",2025-03-19 00:00:44,0,Bob Barnes
Just Eat,5,always great 👍,2025-03-18 14:41:31,0,Benedicte Corneliussen
Just Eat,1,order was wrong. simple.,2025-03-18 00:08:27,0,Stephen Sharp
Just Eat,1,"Rip off, €7 in fees added on to total price. I don't mind delivery for €3.99 but another €3 in service fees then? Why pay this when other delivery places don't even charge a quarter of this? Also to add, half of the reviews on this 4.7 rating are people trying to rate restaurants not actually just eat. Another scam",2025-03-16 19:50:02,0,PDPCNTL
Just Eat,5,very good 👍🏻,2025-03-16 03:14:11,0,Thomaz Deniz Costa
Just Eat,5,"fantastic service,",2025-03-16 00:49:58,0,vinnie callan
Just Eat,1,apache is a ripoff nearly 20 euro for a pizza the same size as my opened hand ✋️ 😳 that's ridiculous it wouldn't fill my back tooth,2025-03-15 05:04:13,0,Ritchie Sweny
Just Eat,5,Good,2025-03-15 04:10:03,0,John Somers
Just Eat,5,I've been a customer for few years now and food is always good. never had any issues,2025-03-14 21:35:17,5,Dorota Lorek
Just Eat,5,homely food 😋 😍 👌,2025-03-14 03:45:16,1,Sam Ferguson
Just Eat,1,"Complaints are disregarded and content noted in the complaint is not looked at, and reply with automated useless replies... that don't resolve the matter. but they charge a heafty ""service charge"" on all orders, but provide little service when things go wrong. At least acknowledge mistakes made & escalate them and provide a resolution.",2025-03-11 22:49:08,0,Daaq 360 (Slainte Gamemaster)
Just Eat,2,"The app works well, but service not so much. Drivers keep your food and no one cares or even seems surprised. You'll get a refund but end up hungry with no food anyways. Switched to competition and deleted the app.",2025-03-11 15:46:26,1,Michaela Novotná
Just Eat,5,Cluck's food is top of the range. Love it!,2025-03-10 01:00:12,0,gerard bozyk
Just Eat,1,"Missing items, cold food by the time you get it or drivers marking your order as delivered when at completely wrong place. Caught one driving away with my order 2 blocks away from my address, he was surprised I bothered. At some point I just lost patience to keep calling restaurant about this bs.",2025-03-09 00:16:52,1,-
Just Eat,5,Delicious food 😋. Thank you.,2025-03-08 23:04:59,1,Kieran Matthew Anthony O'Driscoll
Just Eat,3,Great service but it's getting ridiculous with charges. Have started using alternatives or using the restaurant directly. Food is already priced high and then nearly 10 euro more in charges compared to in the restaurant itself. Crazy and a shame,2025-03-08 00:46:19,3,Murray Mints
Just Eat,1,I have ordered food and both times my order has not shown up no calls from the driver and when I counted just eat for a refund they are no help they said I have missed calls but no one has called and when I emailed they don't get back to me I have video proof that we was not there if I could take away stars I would the customer service is a joke,2025-03-07 21:50:43,1,Keith Rellis
Just Eat,5,excellent service and delivery,2025-03-07 21:34:15,1,Guiglio Pingo
Just Eat,5,the best around limerick eating out off there since the day they opened workers are very nice and kind same delivery drivers lovely to talk to and fast as Well x,2025-03-06 05:47:09,0,Catherine Aylmer
Just Eat,5,This app is so handy.,2025-03-06 01:19:34,0,Lisa Spencer
Just Eat,5,always making it easy to get fed .. simplicity works why complicate things .. A+,2025-03-05 23:09:32,2,Patrick Thomas
Just Eat,5,Excellent addition to the town,2025-03-03 02:38:05,1,Gavin O'Donnell
Just Eat,1,Serious problems with theft from their couriers now. Disgusting,2025-03-01 14:19:02,0,muscle endurance
Just Eat,5,KEBABS,2025-03-01 02:54:36,1,LazFishy *
Just Eat,5,A great favourite since a kid.,2025-03-01 00:38:20,1,Conor McNally
Just Eat,1,stop asking me to review,2025-02-26 06:32:03,0,Jonathan O
Just Eat,1,Just eat has got to expensive to order from both delivery and service charge has gone Up in last few months. 👎 cheaper to drive and collect myself now. plus the restaurant/ take away doesn't lose out on commission..,2025-02-24 19:13:51,1,alan C
Just Eat,5,absolutely gorgeous pizza and very prompt delivery. It arrived hot and was delicious 😋,2025-02-24 00:57:07,6,Helen Ruane
Just Eat,1,Food not delivered. Refused to send it again. Insinuated that my neighbours may have taken it. Very dissatisfied,2025-02-23 00:33:35,0,Nicola McGrath
Just Eat,1,never got my 2 bottles of coke wit my food,2025-02-23 00:23:08,0,Chuck Flanagan
Just Eat,1,"The delivery guy is i think very busy. Didnt gef our food but marked delivered in app. Checked the reception, gate, road, bins, bushes but got nothing outside. Thanks for making 5 hungry nursing staff in a 12hour shift starving until the end of shift. You could have just told us starve iat work nstead if ordering using thiis app. This is a very upsetting shift for us.",2025-02-22 07:44:32,1,Floyd Cacho
Just Eat,1,Scam company. With incompetent drivers,2025-02-21 23:14:46,0,David
Just Eat,5,Great selection of takeaways,2025-02-20 22:59:03,1,mark mc cann
Just Eat,1,useless,2025-02-17 01:03:34,0,Alison Vorley
Just Eat,5,best by far every time.,2025-02-16 02:28:41,0,Peter Lonican
Just Eat,1,1 euro serive charge is outrageous!,2025-02-13 02:02:48,0,Vicente Moritz
Just Eat,1,"overpriced, use local restraunt numbers or their own apps to save money",2025-02-12 14:59:06,0,Technae
Just Eat,2,"Keeps sending me ads in notification despite opting out, scummy behaviour.",2025-02-12 13:08:39,0,Shane Reidy
Just Eat,5,"easy ordering, good deals",2025-02-12 00:51:43,0,Jennifer Hartrey
Just Eat,4,please allow us to tip the drivers through the app,2025-02-10 03:20:36,0,Valerie Redmond
Just Eat,1,Absolute joke of an app. Every time I order from here. They either get it wrong or the food does not deliver. I just ordered food from Burger King which was cost me about 40 Euro and I was left with some chips and some cheesy bites or chicken bites. Plus a paper cup with no drink and I ordered four items. What a joke of an app! This is not just Burger King. It's every place anywhere I Go. It's the same thing. Any location? Poor service. Do not download this app for your own sake,2025-02-09 18:39:39,0,Eoin Cox
Just Eat,5,ye it's pretty good,2025-02-09 00:51:09,0,Eoghan Cavanagh
Just Eat,5,very helpful and easy to work,2025-02-08 20:36:37,0,Lauren Carter
Just Eat,5,greT food great service,2025-02-08 03:35:04,0,Bridget Toye
Just Eat,5,"always on time and the 12"" pizza box is delicious 😋",2025-02-08 01:27:54,0,emanuel emanuel
Just Eat,4,Good but they made me fat 😢,2025-02-07 23:19:34,0,Emma Grace
Just Eat,4,good service. more expensive than ordering directly,2025-02-06 23:42:51,0,CaroleEmma Marry (CarMar6)
Just Eat,3,Food lovely but sauces which are very dear were all spilled,2025-02-05 01:12:48,0,maria O Grady
Just Eat,5,BRILLIANT,2025-02-03 23:26:13,0,Jason Carroll
Just Eat,5,work's well,2025-02-03 21:12:42,0,Gavin Smyth
Just Eat,5,it works when you're hungry,2025-02-01 22:58:37,0,Joseph Middleton
Just Eat,5,great app,2025-02-01 22:19:12,0,Barry Nolan
Just Eat,1,"I am removing this app from my phone. 3 times in the last couple of weeks, I have ordered delivery to our house, and it hasn't shown up. Just says it's delivered, but nothing arrives! No direct contact with the restaurant, so you can't talk to anyone useful. I'm done.",2025-02-01 21:26:04,0,Noelle Ryan
Just Eat,5,very quick and I get my food Piping hot 🔥,2025-01-31 02:24:35,0,MATSEPISO SELLO
Just Eat,5,great,2025-01-30 22:36:38,0,John Martin
Just Eat,5,lovely each time,2025-01-30 21:41:37,0,Natalia Malecka - Moc uzdrawiania
Just Eat,5,good for ordering,2025-01-27 01:38:38,0,Charlie Hayes
Just Eat,5,Awesome,2025-01-26 00:29:49,0,CHANDAN BG
Just Eat,5,easy to use,2025-01-26 00:15:22,0,marie nelson
Just Eat,5,"Great selection of takeaway options, constantly updating their list in every area I've lived or stayed in. The stamp options on certain restaurants is fantastic.",2025-01-25 03:10:42,15,Gregory Treacy
Just Eat,5,the best,2025-01-25 02:27:39,0,Daniel Fee
Just Eat,1,"This app has nothing. No rewards, no good restaurants like other apps",2025-01-24 18:49:10,0,Sana Jonsson
Just Eat,1,Live Discount Offers not Honored.,2025-01-24 05:19:04,0,Gerard Bedell
Just Eat,5,"pleasent drivers, let's you follow your delivery on the app,",2025-01-23 23:03:36,0,Siobhan Byrne
Just Eat,1,robbery and when you have a code won't let you use it,2025-01-20 22:04:41,0,Megan Rowe
Just Eat,2,"Customer service non existent, I've have my share of incomplete orders, cold soggy food, etc, and no response from either the restaurant or Just Eat themselves, I have to contact directly for a fix. I'm seeing service charges creep up from 50c to €3 but no increase in benefit to the customer. Items are often priced higher here than order direct. The only thing it's got going for them is convenience and my fave restaurant rewards loyalty stamps.",2025-01-19 01:42:21,5,Jean Kinsella
Just Eat,5,food is always exceptional and it's always on time ..,2025-01-18 05:18:15,2,John Paul Byrne
Just Eat,5,"Great app, great service, fast resolution of any issues which might arrive with some places. Also nice looking app.",2025-01-18 00:06:18,0,Lavinia Wolter
Just Eat,5,Food,2025-01-16 01:25:38,0,Kyle Carroll
Just Eat,5,Serious,2025-01-13 03:55:13,0,Daniel Cronin
Just Eat,5,easy to use,2025-01-12 23:45:10,0,James Smith
Just Eat,2,service charge is bs,2025-01-12 23:18:21,0,Niall McNally
Just Eat,5,"this is one of the nicest Indian takeaway restaurants in north Dublin, try it its tops",2025-01-12 03:21:35,0,Gareth McGrath
Just Eat,5,it is really handy and i really recomend this app,2025-01-11 23:47:29,0,Tyler O'Hanlon
Just Eat,5,never disappointed.,2025-01-11 00:14:14,0,SUZANNE DE SACHY
Just Eat,5,easy user friendly app good service,2025-01-09 20:32:59,0,Seamus Roche
Just Eat,4,A++,2025-01-09 02:28:42,0,geemailMossman
Just Eat,1,Thanks for the predatory ads that open this page.,2025-01-08 03:06:31,0,Frangild
Just Eat,5,fantastic AA++,2025-01-07 22:27:16,0,Esther storey
Just Eat,4,Great app for take aways,2025-01-07 00:03:44,0,Suzanne Kelly
Just Eat,5,good service 👍,2025-01-06 23:44:55,0,Ohwara Toomee
Just Eat,5,Brilliant.,2025-01-06 01:09:04,0,Aoife Johnston
Just Eat,5,gives me food. thanks,2025-01-05 22:24:22,0,Rytis
Just Eat,3,delivery too expensive,2025-01-05 21:33:21,0,Lara Egbedire
Just Eat,5,great service 👏,2025-01-05 19:45:51,0,Grace Devlin
Just Eat,5,"always best, recommended to everyone",2025-01-05 02:15:17,0,Bart Professional
Just Eat,5,yurt enjoy the show Chris buckley Facebook in the now now. for extra wow wow in the present 🎁 😍 👏 😳 💕 💖 🎁 😍 👏 😳 💕 💖 🎁 😍 👏 😳 💕 💖 🎁 😍 👏 😳 💕 💖 🎁 😍 👏,2025-01-02 22:40:38,0,Chris Buckley
Just Eat,5,just wonderful,2025-01-01 17:19:59,0,Alex Walsh
Just Eat,5,👍,2024-12-31 23:03:28,0,John Carroll
Just Eat,1,"The customer support is poor, my delivery driver took my order number and gave me the wrong order, I told him that that is not my order, he took it back and said to write the email, when I contacted customer support they told me they can't do nothing about it because I gave them the code, we ended up losing 40 pounds and had no food, so people be careful when receiving your orders.",2024-12-31 16:45:29,0,Dorian Bosnjakovic
Just Eat,5,very easy to use the app,2024-12-31 01:07:29,0,Orla Hartnett
Just Eat,5,The Pizza was amazing and the staff were really nice. Good stuff!! 👍,2024-12-28 23:46:45,6,Tushar Nayak
Just Eat,5,Does exactly what it says on the tin,2024-12-28 21:44:25,0,Jo Cullen
Just Eat,4,"It's not the best, but it's still a good delivery app.",2024-12-27 01:28:53,0,Stabb Stabby
Just Eat,5,Happy Christmas for all the work every each person that delivers food and God bless u,2024-12-26 22:33:29,0,paul hicasaurusrex
Just Eat,1,"You'd better be starving ordering from this thing, can't order a normal one person portion thanks to a minimum spend of 13 euro, 2 euro small order fee then 2 - 4 euro delivery 🙃",2024-12-24 01:12:05,1,Gergő Szilágyi
Just Eat,5,Great and amazing,2024-12-21 21:58:33,0,bksazernextking /124
Just Eat,1,it gets the job done but it's a nightmare when things go wrong - was my previous review. I'm done with the app too many excuses for a service it's easier to go direct to the restaurant,2024-12-21 19:27:43,2,Niamh Hudson-Fiorilla
Just Eat,1,I waited nearly an hour for an order that would of taken me about 20 minutes to walk to and back from thanks to a delivery driver taking so long and going to the wrong address. The drivers which the whole system rely upon are unreliable themselves,2024-12-21 00:04:32,1,Dean Lanigan
Just Eat,1,Rip off service fee. Absolute bandits. Do not use.,2024-12-17 22:10:31,1,Stephen McCarthy
Just Eat,5,Great food speedy delivery,2024-12-16 01:14:08,0,Damien Hickey
Just Eat,5,Great food and service.,2024-12-15 21:36:45,0,Mary Pat Fitzpatrick
Just Eat,1,Joke,2024-12-15 03:58:40,1,Matt Lalor
Just Eat,5,very easy to order,2024-12-15 00:10:19,0,Bryan Murray
Just Eat,3,Non stop notifications,2024-12-11 18:22:48,0,liam chartan
Just Eat,5,"Nice, improved.",2024-12-10 18:54:47,0,Marcin Rutkowski
Just Eat,5,this one really goes out to the one 4all voucher I got and couldn't spend anywhere.. but I found out just eat takes them and boom.. tonight we feast like kings,2024-12-09 01:19:28,0,Claire Hourigan
Just Eat,5,Always lovely takes a while to arrive usually but worth the wait.,2024-12-08 23:09:27,0,Denise O'Brien
Just Eat,1,Worst service. Coupn code doesn't get applied during checkout deactivating from service,2024-12-08 18:38:45,1,D K
Just Eat,5,Very good 👍 👏,2024-12-08 00:05:02,0,Shane Heffernan
Just Eat,1,"Terrible. I had one order, my first order, go right. The next few had issues so I was given account credits with no communication and days so silence. Each order had increasing severity of issues up to today where I have been left with no answers after 2 hours in a chat room. Can't get anyone now and it's been an hour since I spoke to a human. If it goes well great, any issues and the app becomes a nightmare",2024-12-07 21:46:51,1,Erin Teape
Just Eat,1,Very bad experience I had with them. I paid for my meal and They delivered my order to someone else and didn't refund my money.I never use this app again,2024-12-05 22:36:02,0,Edilene Da Silva Santos
Just Eat,5,Great 👍,2024-12-05 01:59:10,0,kravchuk007
Just Eat,2,service charge is a joke and one time I'm pretty sure they stole my debit card information,2024-12-03 02:37:36,0,liam hughes
Just Eat,4,delivery cost too much,2024-12-02 19:13:37,0,the Sinead and sean show
Just Eat,4,good,2024-12-01 20:28:36,0,patryk zakurzewski
Just Eat,5,Good food and fast delivery 👍,2024-12-01 17:23:25,0,Des Fox
Just Eat,3,it's 👍,2024-12-01 02:05:33,0,Alla Z
Just Eat,5,quick and friendly delivery,2024-11-30 22:57:56,0,Deirdre Curran
Just Eat,1,"Food regularly doesn't show up, items constantly missing and all they offer is a refund within 3-5 working days instead of just replacing your actual order its ridiculous, I'll never use this service again",2024-11-30 16:24:55,1,Terence Flood
Just Eat,2,One euro service charge is excessive!,2024-11-30 01:21:09,0,Jaroslaw Samo Ha
Just Eat,5,is féidir linn,2024-11-29 21:43:05,0,David Lynch
Just Eat,1,"i wish i could give 0 stars, i live 1 km away from the restaurant i ordered from at 8.30 pm and it didn't arrive till 10.30 pm, i had a get together that gave a bad impression in front of my friends as there was no food available. Pathetic service",2024-11-28 06:12:29,0,Gaurie
Just Eat,5,excellent food ....,2024-11-24 01:12:19,0,Aidan B
Just Eat,5,good options,2024-11-23 01:01:19,0,rupenddra a s
Just Eat,5,Great,2024-11-23 00:49:06,0,Rimantas Bodrov
Just Eat,4,food is always lovely,2024-11-23 00:40:44,0,samira katib
Just Eat,5,app is so easy use and menus are perfectly displayed. options at checkout are extremely helpful regarding payment delivery and preferences about your orders eg no ketchup etc,2024-11-21 00:41:14,8,GRAHAM HODGINS
Just Eat,1,upload correct address,2024-11-20 23:05:29,0,Edel Devlin
Just Eat,2,Slow and many steps to get going or try to call a customer,2024-11-19 06:40:16,0,Omar Omar
Just Eat,5,very good 👍😊,2024-11-18 00:24:25,0,DJ JOHN IN THE MIX 80s 90s
Just Eat,5,always fast and efficient,2024-11-17 01:24:38,0,Michelle Johnstone
Just Eat,5,good,2024-11-16 02:33:09,0,Gibi Shaji
Just Eat,5,"always order here , staff Is lovely and food is always nice",2024-11-16 00:21:17,0,Chloe Delaney
Just Eat,5,very tasty 😋,2024-11-12 01:21:12,0,kristian English
Just Eat,5,very good,2024-11-10 03:04:33,0,Alberto Candeias
Just Eat,5,Amazing,2024-11-10 00:19:51,0,Monika V
Just Eat,1,App logged me our and I haven't been able to get back in. It's been months.,2024-11-09 23:30:32,0,Nicky Ryan
